### ISSUE TITLE
Reflector not capture all

### ISSUE THREAD

**Issue by mguyard** [lathiat/avahi#208]
Hi,

I use a homebridge server on a VLAN A and my iphone who can connect to my homebridge with Home apps is on another VLAN.
I've create a server (VM) who have a interface on each vlans and activate reflector :

`[server]
use-ipv4=yes
use-ipv6=yes
allow-interfaces=ens192,ens224,ens256
ratelimit-interval-usec=1000000
ratelimit-burst=1000
[wide-area]
enable-wide-area=yes
[publish]
publish-hinfo=no
publish-workstation=no
[reflector]
enable-reflector=yes
reflect-ipv=no
[rlimits]
rlimit-core=0
rlimit-data=4194304
rlimit-fsize=0
rlimit-nofile=768
rlimit-stack=4194304
rlimit-nproc=3`

When i browse, i can see device on each vlan :

`root@jeedom-master:~# avahi-browse -all -t
+ ens192 IPv4 roborock-vacuum-s5_miio96557791               _miio._udp           local
+ ens192 IPv4 sonos7828CAC08502                             _spotify-connect._tcp local
+ ens192 IPv4 5c4c43be-c274-bc35-2a04-1abc81d93f93          _googlezone._tcp     local
+ ens192 IPv4 b3e6fe37-c008-568c-c1b0-4abe4b46693a          _googlezone._tcp     local
+ ens192 IPv4 188bf0e2-fd80-970e-73e1-3b30df12327f          _googlezone._tcp     local
+ ens192 IPv4 Google-Home-Mini-188bf0e2fd80970e73e13b30df12327f _googlecast._tcp     local
+ ens192 IPv4 Google-Cast-Group-D3D8444403304C4CAC8D21D05F9D0A46-1 _googlecast._tcp     local
+ ens192 IPv4 Google-Home-Mini-5c4c43bec274bc352a041abc81d93f93 _googlecast._tcp     local
+ ens192 IPv4 Google-Home-Mini-b3e6fe37c008568cc1b04abe4b46693a _googlecast._tcp     local
+ ens192 IPv4 Hades                                         _device-info._tcp    local
+ ens192 IPv4 Hades                                         Apple File Sharing   local
+ ens192 IPv4 Hades                                         Web Site             local
+ ens192 IPv4 Hades                                         Microsoft Windows Network local
+ ens192 IPv4 Salon                                         _airplay._tcp        local
+ ens192 IPv4 7828CAC08502@Salon                            AirTunes Remote Audio local
+ ens192 IPv4 70-35-60-63.1 Apple TV___suite parentale      _sleep-proxy._udp    local
+ ens192 IPv4 49CC1F4D-60AE-59D6-B015-FF08A08F363A          _homekit._tcp        local
+ ens192 IPv4 Apple TV___suite parentale                    _mediaremotetv._tcp  local
+ ens192 IPv4 Apple TV___suite parentale                    _companion-link._tcp local
+ ens192 IPv4 D0D2B08044F8@Apple TV___suite parentale       AirTunes Remote Audio local
+ ens192 IPv4 Apple TV___suite parentale                    _airplay._tcp        local
+ ens192 IPv4 5CD7C2C1938DE66DBED801D96FF83E8E1CE9ACB2      iPod Touch Music Library local
+ ens192 IPv4 5CD7C2C1938DE66DBED801D96FF83E8E1CE9ACB2      _appletv-v2._tcp     local
+ ens192 IPv4 Imprimante Maison MGU                         PDL Printer          local
+ ens192 IPv4 Imprimante Maison MGU                         _uscan._tcp          local
+ ens192 IPv4 Imprimante Maison MGU                         _http-alt._tcp       local
+ ens192 IPv4 Imprimante Maison MGU                         _scanner._tcp        local
+ ens192 IPv4 Imprimante Maison MGU                         Web Site             local
+ ens192 IPv4 Imprimante Maison MGU                         Internet Printer     local
+ ens192 IPv4 iMac de Marc GXXXXX                           VNC Remote Access    local
+ ens192 IPv4 iMac de Marc GXXXXX                           _companion-link._tcp local`

But i don't see my homebridge.
But i receive mdsn to multicast as you can see in the tcpdump :

`root@avahi-reflector:~# tcpdump -n udp dst port 5353 -i ens256
tcpdump: verbose output suppressed, use -v or -vv for full protocol decode
listening on ens256, link-type EN10MB (Ethernet), capture size 262144 bytes
10:23:52.290057 IP 192.168.60.2.5353 > 224.0.0.251.5353: 0*- [0q] 4/0/0 PTR Jeedom-Prod-Master-1C0C._hap._tcp.local., SRV 7E_3D_AA_C8_CC_60.local.:51826 0 0, TXT "md=Jeedom-Prod-Master" "pv=1.0" "id=7E:3D:AA:C8:CC:60" "c#=560" "s#=1" "ff=0" "ci=2" "sf=0" "sh=7rgwfQ==", A 192.168.60.2 (341)

10:23:55.290490 IP 192.168.60.2.5353 > 224.0.0.251.5353: 0*- [0q] 4/0/0 PTR Jeedom-Prod-Master-1C0C._hap._tcp.local., SRV 7E_3D_AA_C8_CC_60.local.:51826 0 0, TXT "md=Jeedom-Prod-Master" "pv=1.0" "id=7E:3D:AA:C8:CC:60" "c#=560" "s#=1" "ff=0" "ci=2" "sf=0" "sh=7rgwfQ==", A 192.168.60.2 (341)
10:23:58.293664 IP 192.168.60.2.5353 > 224.0.0.251.5353: 0*- [0q] 4/0/0 PTR Jeedom-Prod-Master-1C0C._hap._tcp.local., SRV 7E_3D_AA_C8_CC_60.local.:51826 0 0, TXT "md=Jeedom-Prod-Master" "pv=1.0" "id=7E:3D:AA:C8:CC:60" "c#=560" "s#=1" "ff=0" "ci=2" "sf=0" "sh=7rgwfQ==", A 192.168.60.2 (341)`

and reflector forward to other vlans :

`root@avahi-reflector:~# tcpdump -n udp dst port 5353 -i ens192
tcpdump: verbose output suppressed, use -v or -vv for full protocol decode
listening on ens192, link-type EN10MB (Ethernet), capture size 262144 bytes
10:23:13.266948 IP 192.168.40.10.5353 > 224.0.0.251.5353: 0*- [0q] 4/0/0 PTR Jeedom-Prod-Master-1C0C._hap._tcp.local., A 192.168.60.2, TXT "md=Jeedom-Prod-Master" "pv=1.0" "id=7E:3D:AA:C8:CC:60" "c#=560" "s#=1" "ff=0" "ci=2" "sf=0" "sh=7rgwfQ==", SRV 7E_3D_AA_C8_CC_60.local.:51826 0 0 (220)
10:23:15.094712 IP 192.168.40.10.5353 > 224.0.0.251.5353: 0 PTR (QM)? _googlezone._tcp.local. (40)
10:23:15.095503 IP 192.168.40.10.5353 > 224.0.0.251.5353: 0*- [0q] 4/0/0 PTR 188bf0e2-fd80-970e-73e1-3b30df12327f._googlezone._tcp.local., (Cache flush) A 192.168.30.216, (Cache flush) SRV 188bf0e2-fd80-970e-73e1-3b30df12327f.local.:10001 610 36, (Cache flush) TXT "id=9B33F3D4E1C0713FA0F59DF67F8499AB" "D3D84444-0330-4C4C-AC8D-21D05F9D0A46=0|Suite Parentale" "__common_time__=0|0" (281)
10:23:15.107992 IP 192.168.40.10.5353 > 224.0.0.251.5353: 0*- [0q] 4/0/0 PTR 5c4c43be-c274-bc35-2a04-1abc81d93f93._googlezone._tcp.local., (Cache flush) A 192.168.30.224, (Cache flush) SRV 5c4c43be-c274-bc35-2a04-1abc81d93f93.local.:10001 610 40, (Cache flush) TXT "id=B79D4E4D3A2860B0DE3999131FF3870B" "D3D84444-0330-4C4C-AC8D-21D05F9D0A46=1|Suite Parentale" "__common_time__=1|9981" (284)
10:23:15.108841 IP 192.168.40.10.5353 > 224.0.0.251.5353: 0*- [0q] 4/0/0 PTR b3e6fe37-c008-568c-c1b0-4abe4b46693a._googlezone._tcp.local., (Cache flush) A 192.168.30.244, (Cache flush) SRV b3e6fe37-c008-568c-c1b0-4abe4b46693a.local.:10001 610 37, (Cache flush) TXT "id=3B389773C4786087A87DA10740BD2605" "__common_time__=0|0" (226)
10:23:15.196551 IP 192.168.40.10.5353 > 224.0.0.251.5353: 0 [1a] SRV (QM)? 5c4c43be-c274-bc35-2a04-1abc81d93f93._googlezone._tcp.local. (134)
10:23:15.198291 IP 192.168.40.10.5353 > 224.0.0.251.5353: 0 [3a] PTR (QM)? _googlezone._tcp.local. (193)
10:23:15.198398 IP 192.168.40.10.5353 > 224.0.0.251.5353: 0 [1a] SRV (QM)? b3e6fe37-c008-568c-c1b0-4abe4b46693a._googlezone._tcp.local. (134)
10:23:15.604684 IP 192.168.40.10.5353 > 224.0.0.251.5353: 0 PTR (QM)? _googlecast._tcp.local. (40)
10:23:15.606923 IP 192.168.40.10.5353 > 224.0.0.251.5353: 0*- [0q] 4/0/0 PTR Google-Home-Mini-188bf0e2fd80970e73e13b30df12327f._googlecast._tcp.local., (Cache flush) A 192.168.30.216, (Cache flush) SRV 188bf0e2-fd80-970e-73e1-3b30df12327f.local.:8009 0 0, (Cache flush) TXT "id=188bf0e2fd80970e73e13b30df12327f" "cd=9B33F3D4E1C0713FA0F59DF67F8499AB" "rm=F077CE43CAC73C63" "ve=05" "md=Google Home Mini" "ic=/setup/icon.png" "fn=Chambre parentale" "ca=2052" "st=0" "bs=FA8FCA6B1206" "nf=1" "rs=" (379)
10:23:15.607235 IP 192.168.40.10.5353 > 224.0.0.251.5353: 0 SRV (QM)? google-home-mini-b3e6fe37c008568cc1b04abe4b46693a._googlecast._tcp.local. (90)
10:23:15.607666 IP 192.168.40.10.5353 > 224.0.0.251.5353: 0 SRV (QM)? google-home-mini-5c4c43bec274bc352a041abc81d93f93._googlecast._tcp.local. (90)
10:23:15.610872 IP 192.168.40.10.5353 > 224.0.0.251.5353: 0 SRV (QM)? google-cast-group-d3d8444403304c4cac8d21d05f9d0a46-1._googlecast._tcp.local. (93)
10:23:15.708437 IP 192.168.40.10.5353 > 224.0.0.251.5353: 0 [1a] PTR (QM)? _googlecast._tcp.local. (104)`

When i look on my iphone with app "Discovery - DNS - SD Browser" i can see each entries find in avahi-browser. and for example, another one on the homekit vlan who is roborock-vacuum-s5_miio96557791.
But i don't see my Homekit Jeedom-Prod-Master-1C0C._hap._tcp.local.

**Can you help me to understand why i receive (see in tcpdump) mdns from my homebridge and it's not in my avahi-browser but seems to be forward (reflector) as we can see in this tcpdump :**

`10:23:13.266948 IP 192.168.40.10.5353 > 224.0.0.251.5353: 0*- [0q] 4/0/0 PTR Jeedom-Prod-Master-1C0C._hap._tcp.local., A 192.168.60.2, TXT "md=Jeedom-Prod-Master" "pv=1.0" "id=7E:3D:AA:C8:CC:60" "c#=560" "s#=1" "ff=0" "ci=2" "sf=0" "sh=7rgwfQ==", SRV 7E_3D_AA_C8_CC_60.local.:51826 0 0 (220)`

Thanks for your help
